{
  "schema_id": "ATLAS_CLARUS_CANONICAL_FIXTURE_MATRIX_V1",
  "workflow_version": "3.4.0",
  "master_sha256": "8283ab91b10f89ac758d09ecf5fb4d6343536600a06dd468b1cc1ecf4ec747c4",
  "fixtures": {
    "EXACT_GREEN": {
      "mode": "RGB_ONLY_DLambda_POSTHOC",
      "input_rgb": [170, 195, 60],
      "source_atlas_row_id": 4085,
      "source_reference": "H110_L075_C065",
      "source_rgb": [170, 195, 60],
      "source_rgb_distance_squared": 0
    },
    "INKSCAPE_NONZERO_NEAREST": {
      "mode": "RGB_ONLY_DLambda_POSTHOC",
      "input_rgb": [0, 52, 156],
      "source_atlas_row_id": 10519,
      "source_reference": "H285_L025_C065",
      "source_rgb": [0, 55, 157],
      "source_rgb_distance_squared": 10
    },
    "GIMP_NONZERO_NEAREST": {
      "mode": "RGB_ONLY_DLambda_POSTHOC",
      "input_rgb": [61, 123, 25],
      "source_atlas_row_id": 4966,
      "source_reference": "H130_L045_C055",
      "source_rgb": [55, 121, 26],
      "source_rgb_distance_squared": 41
    },
    "KRITA_NONZERO_NEAREST": {
      "mode": "RGB_ONLY_DLambda_POSTHOC",
      "input_rgb": [242, 226, 214],
      "source_atlas_row_id": 1660,
      "source_reference": "H050_L090_C010",
      "source_rgb": [243, 223, 212],
      "source_rgb_distance_squared": 14
    },
    "ACTIVE_TWO_ID_CHANGE": {
      "mode": "RGB_ONLY_DLambda_ACTIVE_PRODUCTION_SELECTION",
      "input_rgb": [170, 195, 60],
      "source_atlas_row_id": 4085,
      "production_atlas_row_id": 3892
    }
  },
  "integration_claims": {
    "inkscape/v0.3.0": "INKSCAPE_NONZERO_NEAREST",
    "gimp/v0.1.3": "GIMP_NONZERO_NEAREST",
    "krita/v0.3.4": "KRITA_NONZERO_NEAREST"
  }
}
